{
  "id": "22222222-2222-4222-8222-222222222222",
  "schema_version": "0.1.0",
  "revision": 1,
  "created_at": "2026-10-20T09:00:00Z",
  "updated_at": "2026-10-20T09:00:00Z",
  "name": "Synthetic review stack",
  "class": "shared_stack",
  "owner_principal_id": "33333333-3333-4333-8333-333333333333",
  "sensitivity": "internal",
  "description": null
}
